{"$schema":"https://json-schema.org/draft/2020-12/schema","$id":"https://mindclade.dev/schemas/batch-receipt/v1","title":"BatchReceipt","type":"object","additionalProperties":false,"required":["schema_version","kind","metadata","spec","lineage","integrity"],"properties":{"schema_version":{"const":"mindclade.batch-receipt/v1"},"kind":{"const":"BatchReceipt"},"metadata":{"$ref":"#/$defs/metadata"},"spec":{"type":"object","additionalProperties":false,"required":["run","batch_index","input","attempt_id","lease_epoch","sample_count","progress_fraction","loss","loss_units"],"properties":{"run":{"type":"string","pattern":"^tenants/[A-Za-z0-9._~-]+/projects/[A-Za-z0-9._~-]+/trainingRuns/[A-Za-z0-9._~-]+$"},"batch_index":{"type":"integer","minimum":0},"input":{"$ref":"#/$defs/artifact_ref"},"attempt_id":{"type":"string","minLength":1,"maxLength":128},"lease_epoch":{"type":"integer","minimum":1},"sample_count":{"type":"integer","minimum":1,"maximum":1048576},"progress_fraction":{"type":"number","minimum":0,"maximum":1},"loss":{"type":"number"},"loss_units":{"type":"string","minLength":1,"maxLength":32}}},"lineage":{"type":"array","minItems":1,"maxItems":32,"items":{"$ref":"#/$defs/artifact_ref"}},"integrity":{"$ref":"#/$defs/integrity"}},"$defs":{"digest":{"type":"string","pattern":"^sha256:[a-f0-9]{64}$"},"metadata":{"type":"object","additionalProperties":false,"required":["uid","created_at","producer","classification"],"properties":{"uid":{"type":"string","minLength":1,"maxLength":128},"created_at":{"type":"string","format":"date-time"},"producer":{"type":"string","minLength":1,"maxLength":128},"classification":{"enum":["PUBLIC","INTERNAL","RESTRICTED"]}}},"artifact_ref":{"type":"object","additionalProperties":false,"required":["uri","digest","media_type","schema_version"],"properties":{"uri":{"type":"string","pattern":"^artifacts/[A-Za-z0-9._~/-]+$"},"digest":{"$ref":"#/$defs/digest"},"media_type":{"type":"string","minLength":1,"maxLength":128},"schema_version":{"type":"string","minLength":1,"maxLength":128}}},"integrity":{"type":"object","additionalProperties":false,"required":["payload_digest"],"properties":{"payload_digest":{"$ref":"#/$defs/digest"},"evidence":{"type":"array","maxItems":32,"items":{"$ref":"#/$defs/artifact_ref"}}}}}}
