{"schema_version":"mindclade.batch-receipt/v1","kind":"BatchReceipt","metadata":{"uid":"batch-0001","created_at":"2026-08-31T12:00:00Z","producer":"training-worker","classification":"INTERNAL"},"spec":{"run":"tenants/t1/projects/p1/trainingRuns/run-001","batch_index":0,"input":{"uri":"artifacts/batches/0001","digest":"sha256:aaaaaaaaaaaaaaaaaaaaaaaaaaaaaaaaaaaaaaaaaaaaaaaaaaaaaaaaaaaaaaaa","media_type":"application/vnd.apache.arrow.file","schema_version":"mindclade.training-batch/v1"},"attempt_id":"attempt-001","lease_epoch":1,"sample_count":32,"progress_fraction":0.125,"loss":1.25,"loss_units":"dimensionless"},"lineage":[{"uri":"artifacts/batches/0001","digest":"sha256:aaaaaaaaaaaaaaaaaaaaaaaaaaaaaaaaaaaaaaaaaaaaaaaaaaaaaaaaaaaaaaaa","media_type":"application/vnd.apache.arrow.file","schema_version":"mindclade.training-batch/v1"}],"integrity":{"payload_digest":"sha256:bbbbbbbbbbbbbbbbbbbbbbbbbbbbbbbbbbbbbbbbbbbbbbbbbbbbbbbbbbbbbbbb","evidence":[]}}
